<?xml version="1.0" encoding="utf-8"?>
<csv-transformation-config xmlns:xsi="http://www.w3.org/2001/XMLSchema-instance"
                           xmlns="http://www.ayanahmedov.com/CsvTransform"
                           xsi:schemaLocation="http://www.ayanahmedov.com/CsvTransform csv-transform-schema.xsd">

    <transformation>
        <targetSchemaColumn>average</targetSchemaColumn>
        <elementConstructor>
            <sourceBindPattern>$1,$2</sourceBindPattern>
            <constructorClass>
                <className>com.ayanahmedov.etl.api.objectconstructor.ColumnAverageConstructor</className>
            </constructorClass>
        </elementConstructor>
        <sourceColumn>
            <name>Col-3</name>
            <constructorPosition>1</constructorPosition>
        </sourceColumn>
        <sourceColumn>
            <name>Col-4</name>
            <constructorPosition>2</constructorPosition>
        </sourceColumn>
    </transformation>
</csv-transformation-config>