<?xml version="1.0" encoding="utf-8"?>
<csv-transformation-config xmlns:xsi="http://www.w3.org/2001/XMLSchema-instance"
                           xmlns="http://www.ayanahmedov.com/CsvTransform"
                           xsi:schemaLocation="http://www.ayanahmedov.com/CsvTransform csv-transform-schema.xsd">


    <transformation>
        <targetSchemaColumn>OrderDate</targetSchemaColumn>
        <sourceBindPattern>$1-$2-$3</sourceBindPattern>
        <targetStringFormatter>
            <dateValueFormatter>
                <sourceFormatPattern>yyyy-MM-dd</sourceFormatPattern>
                <targetDateFormat>
                    <formatPattern>MM-dd-YYYY</formatPattern>
                    <zoneId>Europe/Vienna</zoneId>
                </targetDateFormat>
            </dateValueFormatter>
        </targetStringFormatter>
        <sourceColumn>
            <name>Year</name>
            <bindPatternPosition>1</bindPatternPosition>
        </sourceColumn>
        <sourceColumn>
            <name>Month</name>
            <bindPatternPosition>2</bindPatternPosition>
            <sourceValueMapper>com.ayanahmedov.etl.api.sourcemapper.TwoDigitsNormalizer</sourceValueMapper>
        </sourceColumn>
        <sourceColumn>
            <name>Day</name>
            <bindPatternPosition>3</bindPatternPosition>
            <sourceValueMapper>com.ayanahmedov.etl.api.sourcemapper.TwoDigitsNormalizer</sourceValueMapper>
        </sourceColumn>
    </transformation>


    <transformation>
        <targetSchemaColumn>Unit</targetSchemaColumn>
        <sourceBindPattern>gram</sourceBindPattern>
        <targetStringFormatter>
            <stringValueFormatter/>
        </targetStringFormatter>
    </transformation>
</csv-transformation-config>