<?xml version="1.0" encoding="utf-8"?>
<csv-transformation-config xmlns:xsi="http://www.w3.org/2001/XMLSchema-instance"
                           xmlns="http://www.ayanahmedov.com/CsvTransform"
                           xsi:schemaLocation="http://www.ayanahmedov.com/CsvTransform csv-transform-schema.xsd">



    <transformation>
        <targetSchemaColumn>OrderId</targetSchemaColumn>
        <targetStringFormatter>
            <sourceBindPattern>$1</sourceBindPattern>
            <intValueFormatter/>
        </targetStringFormatter>
        <sourceColumn>
            <name>Order Number</name>
            <constructorPosition>1</constructorPosition>
        </sourceColumn>
    </transformation>

    <transformation>
        <targetSchemaColumn>OrderDate</targetSchemaColumn>
        <targetStringFormatter>
            <sourceBindPattern>$1-$2-$3</sourceBindPattern>
            <dateValueFormatter>
                <sourceFormatPattern>yyyy-MM-dd</sourceFormatPattern>
                <targetDateFormat>
                    <formatPattern>YYYY-MM-dd</formatPattern>
                    <zoneId>Europe/Vienna</zoneId>
                </targetDateFormat>
            </dateValueFormatter>
        </targetStringFormatter>
        <sourceColumn>
            <name>Year</name>
            <constructorPosition>1</constructorPosition>
        </sourceColumn>
        <sourceColumn>
            <name>Month</name>
            <constructorPosition>2</constructorPosition>
            <sourceValueMapper>com.ayanahmedov.etl.api.sourcemapper.TwoDigitsNormalizer</sourceValueMapper>
        </sourceColumn>
        <sourceColumn>
            <name>Day</name>
            <constructorPosition>3</constructorPosition>
            <sourceValueMapper>com.ayanahmedov.etl.api.sourcemapper.TwoDigitsNormalizer</sourceValueMapper>
        </sourceColumn>
    </transformation>


    <transformation>
        <targetSchemaColumn>ProductId</targetSchemaColumn>
        <targetStringFormatter>
            <sourceBindPattern>$1</sourceBindPattern>
            <!-- camel casing as described in the take-home test PDF,-->
            <!-- is not really necessary. Since we map simply to the name
    <transformation>we want at the end.-->
            <stringValueFormatter/>
        </targetStringFormatter>
        <sourceColumn>
            <name>Product Number</name>
            <constructorPosition>1</constructorPosition>
        </sourceColumn>
    </transformation>

    <transformation>
        <targetSchemaColumn>ProductName</targetSchemaColumn>
        <targetStringFormatter>
            <sourceBindPattern>$1</sourceBindPattern>
            <stringValueFormatter/>
        </targetStringFormatter>
        <sourceColumn>
            <name>Product Name</name>
            <constructorPosition>1</constructorPosition>
        </sourceColumn>
    </transformation>

    <transformation>
        <targetSchemaColumn>Quantity</targetSchemaColumn>
        <targetStringFormatter>
            <sourceBindPattern>$1</sourceBindPattern>
            <formatterClass>
                <className>com.ayanahmedov.etl.api.tostringformatter.BigDecimalByLocaleFormatter</className>
                <parameter>
                    <name>locale</name>
<!--                    see java.util.Locale#forLanguageTag for possible values-->
                    <value>en-US</value>
                </parameter>
            </formatterClass>
        </targetStringFormatter>
        <sourceColumn>
            <name>Count</name>
            <constructorPosition>1</constructorPosition>
        </sourceColumn>
    </transformation>

    <transformation>
        <targetSchemaColumn>Unit</targetSchemaColumn>
        <targetStringFormatter>
            <sourceBindPattern>$1</sourceBindPattern>
            <stringValueFormatter/>
        </targetStringFormatter>
        <constantSource>
            <value>kg</value>
            <constructorPosition>1</constructorPosition>
        </constantSource>
    </transformation>
</csv-transformation-config>