<?xml version="1.0" encoding="utf-8"?>
<csv-transformation-config xmlns:xsi="http://www.w3.org/2001/XMLSchema-instance"
                           xmlns="http://www.ayanahmedov.com/CsvTransform"
                           xsi:schemaLocation="http://www.ayanahmedov.com/CsvTransform csv-transform-schema.xsd">

    <transformation>
        <targetSchemaColumn>formatted</targetSchemaColumn>
        <targetStringFormatter>
            <sourceBindPattern>$1,$2,$1</sourceBindPattern>
            <formatterClass>
                <className>com.ayanahmedov.etl.api.tostringformatter.FormattingToStringFormatter</className>
                <parameter>
                    <name>string-format</name>
                    <value>%5s:%s.  %s</value>
                </parameter>
            </formatterClass>
        </targetStringFormatter>
        <sourceColumn>
            <name>Col-1</name>
            <constructorPosition>1</constructorPosition>
        </sourceColumn>
        <sourceColumn>
            <name>Col-2</name>
            <constructorPosition>2</constructorPosition>
        </sourceColumn>
    </transformation>
</csv-transformation-config>