<?xml version="1.0" encoding="utf-8"?>
<csv-transformation-config xmlns:xsi="http://www.w3.org/2001/XMLSchema-instance"
                           xmlns="http://www.ayanahmedov.com/CsvTransform"
                           xsi:schemaLocation="http://www.ayanahmedov.com/CsvTransform csv-transform-schema.xsd">


    <transformation>
        <targetSchemaColumn>OrderId</targetSchemaColumn>
        <sourceBindPattern>$1</sourceBindPattern>
        <targetStringFormatter>
            <intValueFormatter/>
        </targetStringFormatter>
        <sourceColumn>
            <name>THIS DOES NOT EXISTS</name>
            <bindPatternPosition>1</bindPatternPosition>
        </sourceColumn>
    </transformation>
</csv-transformation-config>